{
  "audit_required_layers": [
    "execution_status",
    "persistence_status",
    "structural_status"
  ],
  "authority": {
    "id": "source",
    "sha256": "5ce23817608f5ae304e2a1c72dc938db507f5b10787639f3e372c06859fa8e3f"
  },
  "code": {
    "id": "code",
    "path": "code.py",
    "sha256": "23df806a901ade86694ac4699ed31ba874e8f183c34d2893449ba44f821e1bf9"
  },
  "config": {
    "id": "config",
    "path": "config.json",
    "sha256": "3f9f20f5748bb93e8665a9593656a8cca8d112b0176ebdef46636fa90d9d929b"
  },
  "inference": {
    "context_tokens": 4096,
    "fallback": false,
    "max_input_tokens": 1024,
    "max_output_tokens": 128,
    "request_count": 1,
    "retry": 0,
    "seed": 123,
    "temperature": 0,
    "top_p": 1
  },
  "inputs": [
    {
      "id": "derived",
      "path": "derived.txt",
      "sha256": "b74c18940fb17c24652094028f0c4ee2f8ed73a64bb1bd84be664344c2804c62"
    }
  ],
  "lineage_sha256": "1a7cac46f478d6f52e8087eea25bed1a45108cd5e7920fc24d6bdea29bb738be",
  "model": {
    "id": "model",
    "path": "model.txt",
    "sha256": "be322789ec3ac6bd7532e655958d23259157a9c09a23a7726bacd0002cf9a57c"
  },
  "outputs": [
    {
      "id": "result",
      "path": "result.json",
      "schema": "result.schema.json",
      "schema_sha256": "e29f95bbd4e2d87cb605a9db12e75283163d4d577e5b1b4a3f713d1888a94dc6"
    }
  ],
  "prerequisites": [
    {
      "evidence": {
        "path": "prerequisite.txt",
        "sha256": "40ba6886377ac6aba60cf8d30e5eab4c2c4fd7bc65b596fe4b47b1d2e3956c9e"
      },
      "name": "fixture_available",
      "status": "PASS"
    }
  ],
  "runtime": {
    "platform": "linux",
    "python": "3.10.12"
  },
  "schema_version": "1"
}
